{
  "schemaVersion": "1.0",
  "kind": "visual-semantic-projection-result",
  "requestId": "junior-readable-measurement-semantic-projection",
  "subjectPack": "junior-physics-answer",
  "fixtureKind": "synthetic_fixture",
  "sourceRequestSha256": "7801b5ea7ba9bb47a79bd7ad303f925948302f8c1271e4226eb229ba80cdb80f",
  "semanticDeclaration": {
    "artifactRef": "eval/visual-semantic-projection/cases/junior-readable-measurement.visual-synthetic-semantic-declaration.json",
    "rawByteSha256": "3f50ae04ff2c502d5ca851168ebaf8a9f208063efbf71e63ca7a09058d71bc9d",
    "declarationId": "junior-readable-measurement-semantic-declaration"
  },
  "ocrDiagnosticReport": {
    "artifactRef": "eval/visual-ocr-diagnostics/cases/visual-ocr-diagnostic-report.json",
    "rawByteSha256": "373be1301b61a0ef3fb10976bdab9bf131bdd8d01551a5562fbb1975e4b00a69"
  },
  "textRegionDiagnosticReport": {
    "artifactRef": "eval/visual-text-region-diagnostics/cases/visual-text-region-diagnostic-report.json",
    "rawByteSha256": "a1e73dc4370f189f5c0044ab420614289531531c633f555b09ef7f66893e71d7"
  },
  "associationResult": {
    "artifactRef": "eval/visual-ocr-region-association/cases/junior-readable-measurement.visual-ocr-region-association-result.json",
    "rawByteSha256": "016116b9964e31e412bb40b2ec789a047e42dac7289814925b6e54254370b799",
    "requestId": "junior-readable-measurement"
  },
  "ocrObservationResult": {
    "artifactRef": "eval/visual-ocr-observation/cases/junior-readable-measurement.visual-ocr-observation-result.json",
    "rawByteSha256": "17aa31f7fa71bae34c0c72213b6557546c43b3c038daa1f209743bf67d15c532",
    "requestId": "junior-readable-measurement"
  },
  "crop": {
    "artifactRef": "junior-readable-measurement.crop-2x.png",
    "scale": 2,
    "rawByteSha256": "619e236453646fdb4dfb772b3e8ead65e0597c6118af089f731a57cd57633aa6",
    "decodedRgbPixelSha256": "ac5f2a7abd8ad3aeb98c83ce2db7f9cf2d02b1b7cd357aba0c8323b94b1b01ef",
    "pixelSize": {
      "width": 160,
      "height": 96
    }
  },
  "coordinateSpace": "crop_pixel",
  "projections": [
    {
      "projectionId": "semantic-projection-001",
      "semanticDeclarationRef": "junior-readable-measurement-semantic-declaration",
      "truthLabelRef": "truth-label-001",
      "semanticRole": "measurement_reading",
      "ocrObservationRef": "ocr-observation-001",
      "textRegionCandidateRef": "text-region-001",
      "associationRef": "ocr-region-association-001",
      "recognizedText": "12",
      "projectionBasis": "declared_role_exact_truth_region_association"
    }
  ],
  "summary": {
    "declarationCount": 1,
    "projectedCount": 1,
    "withheldCount": 0,
    "unavailableCount": 0
  },
  "dispositions": {
    "diagnosticScope": "public_synthetic_semantic_projection",
    "semanticStatus": "projected",
    "acceptanceDisposition": "not_accepted",
    "requiresHumanReview": true,
    "layoutDisposition": "not_inferred",
    "figureUnderstandingDisposition": "not_generated",
    "trackDisposition": "not_integrated",
    "deliveryTrustDisposition": "not_projected",
    "wpfDisposition": "not_integrated",
    "liveAcceptanceDisposition": "not_accepted",
    "controlsDisposition": "not_verified",
    "eligible": false,
    "optimizationCandidateRefs": []
  },
  "projectionPolicySha256": "fb550f34fd3d2f2c9fa79bf4a4a3fd9c7391dfabc8b8aa1e0b01b1bdd85b9365",
  "engineProvenance": {
    "engineKind": "deterministic_semantic_projection",
    "engineId": "visual-semantic-projector",
    "engineVersion": "1.0.0",
    "interpreter": {
      "implementation": "CPython",
      "version": "3.13.7"
    },
    "liveProvider": false,
    "cloudEgress": false
  },
  "generatedAt": "2026-07-29T08:03:01Z"
}
